{
  "model_name": "qwen2.5:14b",
  "provider": "ollama",
  "context_window": 32768,
  "scores": {
    "reasoning": 9.25,
    "instruction_following": 7.0,
    "structured_output": 10.0,
    "tool_calling": 10.0,
    "creativity": 9.0
  },
  "strategies": {
    "cot_needed": false,
    "json_mode": true,
    "xml_preferred": false,
    "max_tools_per_call": 15,
    "prompt_length_sweet_spot": 18022,
    "examples_needed": 1,
    "reasoning_scaffolding": "none"
  },
  "calibrated_at": "2026-08-03T15:02:23.682478",
  "version": 1,
  "notes": ""
}