{
  "model_name": "deepseek-coder-v2:16b",
  "provider": "ollama",
  "context_window": 16384,
  "scores": {
    "reasoning": 6.0,
    "instruction_following": 7.5,
    "structured_output": 9.75,
    "tool_calling": 10.0,
    "creativity": 9.0
  },
  "strategies": {
    "cot_needed": false,
    "json_mode": true,
    "xml_preferred": false,
    "max_tools_per_call": 15,
    "prompt_length_sweet_spot": 9011,
    "examples_needed": 1,
    "reasoning_scaffolding": "light"
  },
  "calibrated_at": "2026-08-03T15:03:21.356908",
  "version": 1,
  "notes": ""
}